paper_id,query,journal,publication_date,publication_year,field,fwci,cited_by_count,doi,issn_l,source_type
f4465d25f7c9,如何通过单原子催化剂设计突破类芬顿催化中活性与稳定性的权衡？,Nature Communications,2025-01-02,2025,Electrocatalysts for Energy Conversion,93.87822721,96,https://doi.org/10.1038/s41467-024-55622-y,2041-1723,journal
b5d9e2f1eeaf,如何提升中红外光电探测器的探测率与响应速度至理论极限？,Nature Communications,2025-01-10,2025,Advanced Semiconductor Detectors and Materials,163.74682493,81,https://doi.org/10.1038/s41467-025-55887-x,2041-1723,journal
49822610b620,如何通过高模量隔膜设计解决锌枝晶问题,Nature Communications,2025-01-25,2025,Advanced battery technologies research,163.74682493,81,https://doi.org/10.1038/s41467-025-56325-8,2041-1723,journal
3e2570ebbc22,如何构建基于深度学习的多模态框架来评估电池健康状态？,Nature Communications,2025-01-29,2025,Advanced Battery Technologies Research,156.77105282,72,https://doi.org/10.1038/s41467-025-56485-7,2041-1723,journal
9d7ad46d50d0,如何利用吸湿性铁水凝胶和叶脉结构设计高效的能量收集器？,Nature Communications,2025-06-06,2025,Energy Harvesting in Wireless Networks,153.63899623,76,https://doi.org/10.1038/s41467-025-60341-z,2041-1723,journal
