paperId,externalIds,title,venue,year,citationCount,openAccessPdf,publicationTypes,authors,abstract,strategy
6b238b17e419c7dd3912b9845449496bfb0a571a,"{'PubMedCentral': '11711098', 'DBLP': 'journals/nature/HollmannMPKKHSH25', 'DOI': '10.1038/s41586-024-08328-6', 'CorpusId': 275420209, 'PubMed': '39780007'}",Accurate predictions on small data with a tabular foundation model,Nature,2025,520,"{'url': 'https://doi.org/10.1038/s41586-024-08328-6', 'status': 'HYBRID', 'license': 'CCBY', 'disclaimer': 'Notice: Paper or abstract available at https://pmc.ncbi.nlm.nih.gov/articles/PMC11711098, which is subject to the license by the author or copyright owner provided with this content. Please go to the source to verify the license and copyright information for your use.'}",['JournalArticle'],"[{'authorId': '2073442519', 'name': 'Noah Hollmann'}, {'authorId': '2087002488', 'name': 'Samuel G. Müller'}, {'authorId': '2300096908', 'name': 'Lennart Purucker'}, {'authorId': '35064488', 'name': 'Arjun Krishnakumar'}, {'authorId': '2339363069', 'name': 'Max Körfer'}, {'authorId': '2338825392', 'name': 'Shi Bin Hoo'}, {'authorId': '9948572', 'name': 'R. Schirrmeister'}, {'authorId': '2248700745', 'name': 'Frank Hutter'}]","Tabular data, spreadsheets organized in rows and columns, are ubiquitous across scientific fields, from biomedicine to particle physics to economics and climate science1,2. The fundamental prediction task of filling in missing values of a label column based on the rest of the columns is essential for various applications as diverse as biomedical risk models, drug discovery and materials science. Although deep learning has revolutionized learning from raw data and led to numerous high-profile success stories3, 4–5, gradient-boosted decision trees6, 7, 8–9 have dominated tabular data for the past 20 years. Here we present the Tabular Prior-data Fitted Network (TabPFN), a tabular foundation model that outperforms all previous methods on datasets with up to 10,000 samples by a wide margin, using substantially less training time. In 2.8 s, TabPFN outperforms an ensemble of the strongest baselines tuned for 4 h in a classification setting. As a generative transformer-based foundation model, this model also allows fine-tuning, data generation, density estimation and learning reusable embeddings. TabPFN is a learning algorithm that is itself learned across millions of synthetic datasets, demonstrating the power of this approach for algorithm development. By improving modelling abilities across diverse fields, TabPFN has the potential to accelerate scientific discovery and enhance important decision-making in various domains. Tabular Prior-data Fitted Network, a tabular foundation model, provides accurate predictions on small data and outperforms all previous methods on datasets with up to 10,000 samples by a wide margin.",nature_2025_custom
963e3287352051da5d113a3f511c2edc8a718a01,"{'DBLP': 'journals/nature/ZeniPZFHFWSCUSSSNSLHLZY25', 'PubMedCentral': '11922738', 'DOI': '10.1038/s41586-025-08628-5', 'CorpusId': 275591809, 'PubMed': '39821164'}",A generative model for inorganic materials design,Nature,2025,317,"{'url': '', 'status': 'CLOSED', 'license': 'CCBY', 'disclaimer': 'Notice: Paper or abstract available at https://pmc.ncbi.nlm.nih.gov/articles/PMC11922738, which is subject to the license by the author or copyright owner provided with this content. Please go to the source to verify the license and copyright information for your use.'}",['JournalArticle'],"[{'authorId': '2270698306', 'name': 'Claudio Zeni'}, {'authorId': '51312865', 'name': 'Robert Pinsler'}, {'authorId': '2340577769', 'name': 'Daniel Zügner'}, {'authorId': '2270002912', 'name': 'Andrew Fowler'}, {'authorId': '2270216087', 'name': 'Matthew Horton'}, {'authorId': '2119032930', 'name': 'Xiang Fu'}, {'authorId': '2340641587', 'name': 'Zilong Wang'}, {'authorId': '123830349', 'name': 'Aliaksandra Shysheya'}, {'authorId': '2340577776', 'name': 'Jonathan Crabbé'}, {'authorId': '2340578216', 'name': 'Shoko Ueda'}, {'authorId': '2340577126', 'name': 'Roberto Sordillo'}, {'authorId': '2271696492', 'name': 'Lixin Sun'}, {'authorId': '2259306230', 'name': 'Jake Smith'}, {'authorId': '2340579016', 'name': 'Bichlien H. Nguyen'}, {'authorId': '2334360285', 'name': 'Hannes Schulz'}, {'authorId': '2336642703', 'name': 'Sarah Lewis'}, {'authorId': '2340789477', 'name': 'Chin-Wei Huang'}, {'authorId': '2266758111', 'name': 'Ziheng Lu'}, {'authorId': '2266757173', 'name': 'Yichi Zhou'}, {'authorId': '2300328816', 'name': 'Han Yang'}, {'authorId': '2266466627', 'name': 'Hongxia Hao'}, {'authorId': '2266802121', 'name': 'Jielan Li'}, {'authorId': '2304552332', 'name': 'Chunlei Yang'}, {'authorId': '2340690443', 'name': 'Wenjie Li'}, {'authorId': '2270690278', 'name': 'Ryota Tomioka'}, {'authorId': '2258947543', 'name': 'Tian Xie'}]","The design of functional materials with desired properties is essential in driving technological advances in areas such as energy storage, catalysis and carbon capture1, 2–3. Generative models accelerate materials design by directly generating new materials given desired property constraints, but current methods have a low success rate in proposing stable crystals or can satisfy only a limited set of property constraints4, 5, 6, 7, 8, 9, 10–11. Here we present MatterGen, a model that generates stable, diverse inorganic materials across the periodic table and can further be fine-tuned to steer the generation towards a broad range of property constraints. Compared with previous generative models4,12, structures produced by MatterGen are more than twice as likely to be new and stable, and more than ten times closer to the local energy minimum. After fine-tuning, MatterGen successfully generates stable, new materials with desired chemistry, symmetry and mechanical, electronic and magnetic properties. As a proof of concept, we synthesize one of the generated structures and measure its property value to be within 20% of our target. We believe that the quality of generated materials and the breadth of abilities of MatterGen represent an important advancement towards creating a foundational generative model for materials design. MatterGen is a model that generates stable, diverse inorganic materials across the periodic table and can further be fine-tuned to steer the generation towards a broad range of property constraints.",nature_2025_custom
2eed1fad9bbf887d4395de40f20144c4fafefd7f,"{'PubMedCentral': '12443585', 'DBLP': 'journals/nature/GuoYZSWZXZMBZY025', 'ArXiv': '2501.12948', 'DOI': '10.1038/s41586-025-09422-z', 'CorpusId': 275789950, 'PubMed': '40962978'}",DeepSeek-R1 incentivizes reasoning in LLMs through reinforcement learning,Nature,2025,5469,"{'url': '', 'status': None, 'license': 'CCBY', 'disclaimer': 'Notice: Paper or abstract available at https://arxiv.org/abs/2501.12948, which is subject to the license by the author or copyright owner provided with this content. Please go to the source to verify the license and copyright information for your use.'}",['JournalArticle'],"[{'authorId': '2307073216', 'name': 'DeepSeek-AI'}, {'authorId': '2278834796', 'name': 'Daya Guo'}, {'authorId': '2278404250', 'name': 'Dejian Yang'}, {'authorId': '2278587222', 'name': 'Haowei Zhang'}, {'authorId': '2258088582', 'name': 'Jun-Mei Song'}, {'authorId': '2337775212', 'name': 'Ruoyu Zhang'}, {'authorId': '2274917091', 'name': 'R. Xu'}, {'authorId': '2278223869', 'name': 'Qihao Zhu'}, {'authorId': '2278830967', 'name': 'Shirong Ma'}, {'authorId': '2330130435', 'name': 'Peiyi Wang'}, {'authorId': '2289212464', 'name': 'Xiaoling Bi'}, {'authorId': '2327287516', 'name': 'Xiaokang Zhang'}, {'authorId': '2279159169', 'name': 'Xingkai Yu'}, {'authorId': '2335511292', 'name': 'Yu Wu'}, {'authorId': '2316170048', 'name': 'Z. F. Wu'}, {'authorId': '1797090', 'name': 'Zhibin Gou'}, {'authorId': '144485528', 'name': 'Zhihong Shao'}, {'authorId': '2309773899', 'name': 'Zhuoshu Li'}, {'authorId': '2337771690', 'name': 'Ziyi Gao'}, {'authorId': '2278677183', 'name': 'A. Liu'}, {'authorId': '2337687235', 'name': 'Bing Xue'}, {'authorId': '2244285627', 'name': 'Bing-Li Wang'}, {'authorId': '2337844023', 'name': 'Bochao Wu'}, {'authorId': '2337688451', 'name': 'Bei Feng'}, {'authorId': '2337772642', 'name': 'Chengda Lu'}, {'authorId': '2278389597', 'name': 'Chenggang Zhao'}, {'authorId': '2278221484', 'name': 'C. Deng'}, {'authorId': '2337705874', 'name': 'Chenyu Zhang'}, {'authorId': '2278217940', 'name': 'C. Ruan'}, {'authorId': '2307085654', 'name': 'Damai Dai'}, {'authorId': '2274200088', 'name': 'Deli Chen'}, {'authorId': '2325992470', 'name': 'Dong-Li Ji'}, {'authorId': '2278218944', 'name': 'Erhang Li'}, {'authorId': '2278589731', 'name': 'Fangyun Lin'}, {'authorId': '2337687526', 'name': 'Fucong Dai'}, {'authorId': '2278218736', 'name': 'Fuli Luo'}, {'authorId': '2278219957', 'name': 'Guangbo Hao'}, {'authorId': '2278589675', 'name': 'Guanting Chen'}, {'authorId': '2337746209', 'name': 'Guowei Li'}, {'authorId': '2337801868', 'name': 'H. Zhang'}, {'authorId': '2287769900', 'name': 'Han Bao'}, {'authorId': '2278643857', 'name': 'Hanwei Xu'}, {'authorId': '2316174862', 'name': 'Haocheng Wang'}, {'authorId': '2278486342', 'name': 'Honghui Ding'}, {'authorId': '2238628841', 'name': 'Huajian Xin'}, {'authorId': '2278395340', 'name': 'Huazuo Gao'}, {'authorId': '2305476903', 'name': 'Hui Qu'}, {'authorId': '2338017035', 'name': 'Hui Li'}, {'authorId': '2278226003', 'name': 'Jianzhong Guo'}, {'authorId': '2278337977', 'name': 'Jiashi Li'}, {'authorId': '2219717571', 'name': 'Jiawei Wang'}, {'authorId': '2337776990', 'name': 'JingChang Chen'}, {'authorId': '2337749769', 'name': 'Jingyang Yuan'}, {'authorId': '2278355944', 'name': 'Junjie Qiu'}, {'authorId': '2337836211', 'name': 'Junlong Li'}, {'authorId': '2333971037', 'name': 'J. Cai'}, {'authorId': '2332054265', 'name': 'J. Ni'}, {'authorId': '2337771119', 'name': 'Jian Liang'}, {'authorId': '2337786826', 'name': 'Jin Chen'}, {'authorId': '2278218552', 'name': 'Kai Dong'}, {'authorId': '2335579723', 'name': 'Kai Hu'}, {'authorId': '2278218724', 'name': 'Kaige Gao'}, {'authorId': '2278219877', 'name': 'Kang Guan'}, {'authorId': '2307742866', 'name': 'Kexin Huang'}, {'authorId': '2329319668', 'name': 'K. Yu'}, {'authorId': '2337705401', 'name': 'Lean Wang'}, {'authorId': '2278256170', 'name': 'Lecong Zhang'}, {'authorId': '2330538675', 'name': 'Liang Zhao'}, {'authorId': '15068726', 'name': 'Litong Wang'}, {'authorId': '2278257096', 'name': 'Liyue Zhang'}, {'authorId': '2337753846', 'name': 'Lei Xu'}, {'authorId': '2337787680', 'name': 'Leyi Xia'}, {'authorId': '2278384213', 'name': 'Mingchuan Zhang'}, {'authorId': '2337708168', 'name': 'Minghua Zhang'}, {'authorId': '2312099468', 'name': 'M. Tang'}, {'authorId': '2338070273', 'name': 'Meng Li'}, {'authorId': '2337775620', 'name': 'Miaojun Wang'}, {'authorId': '2337751092', 'name': 'Mingming Li'}, {'authorId': '2337686905', 'name': 'Ning Tian'}, {'authorId': '2278251752', 'name': 'Panpan Huang'}, {'authorId': '2333052802', 'name': 'Peng Zhang'}, {'authorId': '2198632851', 'name': 'Qiancheng Wang'}, {'authorId': '2307394725', 'name': 'Qinyu Chen'}, {'authorId': '2278218583', 'name': 'Qiushi Du'}, {'authorId': '2278218130', 'name': 'Ruiqi Ge'}, {'authorId': '2337774448', 'name': 'Ruisong Zhang'}, {'authorId': '2337687339', 'name': 'Ruizhe Pan'}, {'authorId': '2337768965', 'name': 'Runji Wang'}, {'authorId': '2337764886', 'name': 'R. J. Chen'}, {'authorId': '2337687334', 'name': 'R. Jin'}, {'authorId': '2288751385', 'name': 'Ruyi Chen'}, {'authorId': '2278389939', 'name': 'Shanghao Lu'}, {'authorId': '2278397391', 'name': 'Shangyan Zhou'}, {'authorId': '2278219833', 'name': 'Shanhuang Chen'}, {'authorId': '2317259871', 'name': 'Shengfeng Ye'}, {'authorId': '2330054226', 'name': 'Shiyu Wang'}, {'authorId': '2278408463', 'name': 'Shuiping Yu'}, {'authorId': '2278398119', 'name': 'Shunfeng Zhou'}, {'authorId': '2337787780', 'name': 'Shuting Pan'}, {'authorId': '2337775628', 'name': 'S. S. Li'}, {'authorId': '2301799594', 'name': 'Shuang Zhou'}, {'authorId': '2157824681', 'name': 'Shao-Kang Wu'}, {'authorId': '2337686938', 'name': 'Tao Yun'}, {'authorId': '2278220142', 'name': 'Tian Pei'}, {'authorId': '2340400824', 'name': 'T. Sun'}, {'authorId': '2337757182', 'name': 'T. Wang'}, {'authorId': '2279051415', 'name': 'Wangding Zeng'}, {'authorId': '2257129965', 'name': 'Wanjia Zhao'}, {'authorId': '2326440587', 'name': 'Wen Liu'}, {'authorId': '2278618633', 'name': 'W. Liang'}, {'authorId': '2377426032', 'name': 'Wenjun Gao'}, {'authorId': '2298210246', 'name': 'Wen-Xia Yu'}, {'authorId': '2341325349', 'name': 'Wentao Zhang'}, {'authorId': '2337790804', 'name': 'W. Xiao'}, {'authorId': '2316966121', 'name': 'Wei An'}, {'authorId': '2257346982', 'name': 'Xiaodong Liu'}, {'authorId': '2337844470', 'name': 'Xiaohan Wang'}, {'authorId': '2326444644', 'name': 'Xiaokang Chen'}, {'authorId': '2278218185', 'name': 'X. Nie'}, {'authorId': '2193630544', 'name': 'Xin Cheng'}, {'authorId': '2336338617', 'name': 'Xin Liu'}, {'authorId': '2239599436', 'name': 'Xin Xie'}, {'authorId': '2326998908', 'name': 'Xingchao Liu'}, {'authorId': '2312345351', 'name': 'Xinyu Yang'}, {'authorId': '2337738744', 'name': 'Xinyuan Li'}, {'authorId': '2278247813', 'name': 'Xuecheng Su'}, {'authorId': '2337776686', 'name': 'Xuheng Lin'}, {'authorId': '2337776625', 'name': 'X. Q. Li'}, {'authorId': '2149112346', 'name': 'Xiangyu Jin'}, {'authorId': '2262432943', 'name': 'Xi-Cheng Shen'}, {'authorId': '2337775973', 'name': 'Xiaosha Chen'}, {'authorId': '2316956218', 'name': 'Xiaowen Sun'}, {'authorId': '2299743807', 'name': 'Xiaoxiang Wang'}, {'authorId': '2337774374', 'name': 'Xinnan Song'}, {'authorId': '2334871182', 'name': 'Xinyi Zhou'}, {'authorId': '2337777409', 'name': 'Xianzu Wang'}, {'authorId': '2337688042', 'name': 'Xinxia Shan'}, {'authorId': '2278599324', 'name': 'Y. K. Li'}, {'authorId': '2337725217', 'name': 'Y. Q. Wang'}, {'authorId': '2337771864', 'name': 'Y. X. Wei'}, {'authorId': '2338171554', 'name': 'Yang Zhang'}, {'authorId': '2324603956', 'name': 'Yanhong Xu'}, {'authorId': '2278381130', 'name': 'Yao Li'}, {'authorId': '2278398317', 'name': 'Yao Zhao'}, {'authorId': '2278377738', 'name': 'Yaofeng Sun'}, {'authorId': '2278432120', 'name': 'Yaohui Wang'}, {'authorId': '2338182791', 'name': 'Yi Yu'}, {'authorId': '2337243026', 'name': 'Yichao Zhang'}, {'authorId': '2337801571', 'name': 'Yifan Shi'}, {'authorId': '2308644697', 'name': 'Yi Xiong'}, {'authorId': '2317034993', 'name': 'Ying He'}, {'authorId': '2278218072', 'name': 'Yishi Piao'}, {'authorId': '2330376936', 'name': 'Yisong Wang'}, {'authorId': '2316968504', 'name': 'Yixuan Tan'}, {'authorId': '2342237203', 'name': 'Yiyang Ma'}, {'authorId': '2278393359', 'name': 'Yiyuan Liu'}, {'authorId': '2317130708', 'name': 'Yongqiang Guo'}, {'authorId': '2337687328', 'name': 'Y. Ou'}, {'authorId': '2337765075', 'name': 'Yuduan Wang'}, {'authorId': '2338990074', 'name': 'Yue Gong'}, {'authorId': '2300352188', 'name': 'Yu-Jing Zou'}, {'authorId': '2337718186', 'name': 'Yujia He'}, {'authorId': '2326446831', 'name': 'Yunfan Xiong'}, {'authorId': '2324528328', 'name': 'Yu-Wei Luo'}, {'authorId': '2054452755', 'name': 'Yu-mei You'}, {'authorId': '2337142726', 'name': 'Yuxuan Liu'}, {'authorId': '2337775637', 'name': 'Yuyang Zhou'}, {'authorId': '2337840145', 'name': 'Y. X. Zhu'}, {'authorId': '2272475376', 'name': 'Yanping Huang'}, {'authorId': '2278381130', 'name': 'Yao Li'}, {'authorId': '2279900058', 'name': 'Yi Zheng'}, {'authorId': '2291197888', 'name': 'Yuchen Zhu'}, {'authorId': '2318919239', 'name': 'Yunxiang Ma'}, {'authorId': '2337979045', 'name': 'Ying Tang'}, {'authorId': '2337687962', 'name': 'Y. Zha'}, {'authorId': '2337777710', 'name': 'Yuting Yan'}, {'authorId': '2278430558', 'name': 'Z. Ren'}, {'authorId': '2278430558', 'name': 'Z. Ren'}, {'authorId': '2278218357', 'name': 'Zhangli Sha'}, {'authorId': '2278223920', 'name': 'Zhe Fu'}, {'authorId': '2337940131', 'name': 'Zhean Xu'}, {'authorId': '2279107352', 'name': 'Zhenda Xie'}, {'authorId': '2148906520', 'name': 'Zhen-guo Zhang'}, {'authorId': '2278220653', 'name': 'Zhewen Hao'}, {'authorId': '2337695745', 'name': 'Zhicheng Ma'}, {'authorId': '2337768819', 'name': 'Zhigang Yan'}, {'authorId': '2326514370', 'name': 'Zhiyu Wu'}, {'authorId': '2307422404', 'name': 'Zihui Gu'}, {'authorId': '2337838091', 'name': 'Zijia Zhu'}, {'authorId': '2117942065', 'name': 'Zijun Liu'}, {'authorId': '2268382130', 'name': 'Zi-An Li'}, {'authorId': '2279107375', 'name': 'Ziwei Xie'}, {'authorId': '2271718109', 'name': 'Ziyang Song'}, {'authorId': '2327000291', 'name': 'Zizheng Pan'}, {'authorId': '2337821867', 'name': 'Zhen Huang'}, {'authorId': '2238223352', 'name': 'Zhipeng Xu'}, {'authorId': '2337972848', 'name': 'Zhongyu Zhang'}, {'authorId': '2329999671', 'name': 'Zhen Zhang'}]","General reasoning represents a long-standing and formidable challenge in artificial intelligence (AI). Recent breakthroughs, exemplified by large language models (LLMs)1,2 and chain-of-thought (CoT) prompting3, have achieved considerable success on foundational reasoning tasks. However, this success is heavily contingent on extensive human-annotated demonstrations and the capabilities of models are still insufficient for more complex problems. Here we show that the reasoning abilities of LLMs can be incentivized through pure reinforcement learning (RL), obviating the need for human-labelled reasoning trajectories. The proposed RL framework facilitates the emergent development of advanced reasoning patterns, such as self-reflection, verification and dynamic strategy adaptation. Consequently, the trained model achieves superior performance on verifiable tasks such as mathematics, coding competitions and STEM fields, surpassing its counterparts trained through conventional supervised learning on human demonstrations. Moreover, the emergent reasoning patterns exhibited by these large-scale models can be systematically used to guide and enhance the reasoning capabilities of smaller models. A new artificial intelligence model, DeepSeek-R1, is introduced, demonstrating that the reasoning abilities of large language models can be incentivized through pure reinforcement learning, removing the need for human-annotated demonstrations.",nature_2025_custom
a64e87937a301e5416342fa232f7226bba780bec,"{'PubMedCentral': '11798842', 'DOI': '10.1038/s41586-024-08375-z', 'CorpusId': 275423901, 'PubMed': '39779863'}",One-quarter of freshwater fauna threatened with extinction,Nature,2025,139,"{'url': '', 'status': None, 'license': 'CCBY', 'disclaimer': 'Notice: Paper or abstract available at https://pmc.ncbi.nlm.nih.gov/articles/PMC11798842, which is subject to the license by the author or copyright owner provided with this content. Please go to the source to verify the license and copyright information for your use.'}",['JournalArticle'],"[{'authorId': '2292255739', 'name': 'Catherine A. Sayer'}, {'authorId': '2339383089', 'name': 'Eresha Fernando'}, {'authorId': '2339378339', 'name': 'Randall R Jiménez'}, {'authorId': '2239185911', 'name': 'Nicholas B. W. Macfarlane'}, {'authorId': '6943563', 'name': 'G. Rapacciuolo'}, {'authorId': '2239256443', 'name': 'M. Böhm'}, {'authorId': '2238341286', 'name': 'Thomas M. Brooks'}, {'authorId': '1417096084', 'name': 'T. Contreras-MacBeath'}, {'authorId': '2259039810', 'name': 'Neil A. Cox'}, {'authorId': '2339373867', 'name': 'Ian Harrison'}, {'authorId': '2147118562', 'name': 'Michael Hoffmann'}, {'authorId': '2339385776', 'name': 'Richard Jenkins'}, {'authorId': '2240446450', 'name': 'Kevin G. Smith'}, {'authorId': '144025854', 'name': 'J. Vié'}, {'authorId': '2318863990', 'name': 'John C. Abbott'}, {'authorId': '2239230834', 'name': 'D. Allen'}, {'authorId': '2244656158', 'name': 'Gerald R. Allen'}, {'authorId': '2339377221', 'name': 'Violeta Barrios'}, {'authorId': '145315437', 'name': 'J. Boudot'}, {'authorId': '39106106', 'name': 'Savrina F. Carrizo'}, {'authorId': '2268133870', 'name': 'Patricia Charvet'}, {'authorId': '31574390', 'name': 'V. Clausnitzer'}, {'authorId': '2239410914', 'name': 'L. Congiu'}, {'authorId': '2252769092', 'name': 'Keith A. Crandall'}, {'authorId': '4781201', 'name': 'N. Cumberlidge'}, {'authorId': '5662808', 'name': 'Annabelle Cuttelod'}, {'authorId': '2339390122', 'name': 'James Dalton'}, {'authorId': '2339382991', 'name': 'Adam G. Daniels'}, {'authorId': '8274171', 'name': 'S. De Grave'}, {'authorId': '146786026', 'name': 'Geert De Knijf'}, {'authorId': '1869049', 'name': 'K. Dijkstra'}, {'authorId': '145634084', 'name': 'R. Dow'}, {'authorId': '2135180376', 'name': 'Jörg Freyhof'}, {'authorId': '2254243172', 'name': 'Nieves García'}, {'authorId': '2267270738', 'name': 'Joern Gessner'}, {'authorId': '2073921491', 'name': 'A. Getahun'}, {'authorId': '40374046', 'name': 'Claudine Gibson'}, {'authorId': '39086338', 'name': 'M. Gollock'}, {'authorId': '2306174099', 'name': 'Michael I. Grant'}, {'authorId': '2339377155', 'name': 'Alice E. R. Groom'}, {'authorId': '2291825682', 'name': 'Michael P. Hammer'}, {'authorId': '2033153598', 'name': 'G. Hammerson'}, {'authorId': '1400807112', 'name': 'C. Hilton‐Taylor'}, {'authorId': '2339378874', 'name': 'Laurel Hodgkinson'}, {'authorId': '2341783105', 'name': 'Robert A. Holland'}, {'authorId': '5866297', 'name': 'R. Jabado'}, {'authorId': '100950795', 'name': 'Diego Juffe Bignoli'}, {'authorId': '4779361', 'name': 'V. Kalkman'}, {'authorId': '8208301', 'name': 'B. Karimov'}, {'authorId': '4331497', 'name': 'J. Kipping'}, {'authorId': '6094283', 'name': 'M. Kottelat'}, {'authorId': '108573272', 'name': 'P. Lalèyè'}, {'authorId': '2330095100', 'name': 'Helen K. Larson'}, {'authorId': '6568151', 'name': 'M. Lintermans'}, {'authorId': '2339379413', 'name': 'Federico Lozano'}, {'authorId': '2257622773', 'name': 'Arne Ludwig'}, {'authorId': '2256580043', 'name': 'Timothy J. Lyons'}, {'authorId': '1403089558', 'name': 'L. Máiz-Tomé'}, {'authorId': '2093405697', 'name': 'Sanjay Molur'}, {'authorId': '40349545', 'name': 'H. Ng'}, {'authorId': '4488986', 'name': 'C. Numa'}, {'authorId': '1572377935', 'name': 'A. F. Palmer-Newton'}, {'authorId': '2339382921', 'name': 'Charlotte Pike'}, {'authorId': '88191150', 'name': 'H. Pippard'}, {'authorId': '2081292112', 'name': 'C. N. M. Polaz'}, {'authorId': '2320450746', 'name': 'Caroline M Pollock'}, {'authorId': '50854244', 'name': 'R. Raghavan'}, {'authorId': '2289737815', 'name': 'Peter S. Rand'}, {'authorId': '2239642339', 'name': 'Tsilavina Ravelomanana'}, {'authorId': '2257322622', 'name': 'Roberto E. Reis'}, {'authorId': '2272529543', 'name': 'Cassandra L. Rigby'}, {'authorId': '39125260', 'name': 'Janet Scott'}, {'authorId': '4647112', 'name': 'P. Skelton'}, {'authorId': '6754416', 'name': 'M. Sloat'}, {'authorId': '2268228037', 'name': 'Jos Snoeks'}, {'authorId': '153790325', 'name': 'M. Stiassny'}, {'authorId': '2284349496', 'name': 'Heok Hui Tan'}, {'authorId': '2339330169', 'name': 'Yoshinori Taniguchi'}, {'authorId': '2239837616', 'name': 'E. B. Thorstad'}, {'authorId': '3776514', 'name': 'M. Tognelli'}, {'authorId': '2190022174', 'name': 'Armi G. Torres'}, {'authorId': '2072336788', 'name': 'Y. Torres'}, {'authorId': '40224796', 'name': 'D. Tweddle'}, {'authorId': '2048727427', 'name': 'Katsutoshi Watanabe'}, {'authorId': '2050587574', 'name': 'James R. S. Westrip'}, {'authorId': '2265730581', 'name': 'Emma G. E. Wright'}, {'authorId': '2339344848', 'name': 'E. Zhang'}, {'authorId': '88780215', 'name': 'W. Darwall'}]","Freshwater ecosystems are highly biodiverse1 and important for livelihoods and economic development2, but are under substantial stress3. To date, comprehensive global assessments of extinction risk have not included any speciose groups primarily living in freshwaters. Consequently, data from predominantly terrestrial tetrapods4,5 are used to guide environmental policy6 and conservation prioritization7, whereas recent proposals for target setting in freshwaters use abiotic factors8, 9, 10, 11, 12–13. However, there is evidence14, 15, 16–17 that such data are insufficient to represent the needs of freshwater species and achieve biodiversity goals18,19. Here we present the results of a multi-taxon global freshwater fauna assessment for The IUCN Red List of Threatened Species covering 23,496 decapod crustaceans, fishes and odonates, finding that one-quarter are threatened with extinction. Prevalent threats include pollution, dams and water extraction, agriculture and invasive species, with overharvesting also driving extinctions. We also examined the degree of surrogacy of both threatened tetrapods and freshwater abiotic factors (water stress and nitrogen) for threatened freshwater species. Threatened tetrapods are good surrogates when prioritizing sites to maximize rarity-weighted richness, but poorer when prioritizing based on the most range-restricted species. However, they are much better surrogates than abiotic factors, which perform worse than random. Thus, although global priority regions identified for tetrapod conservation are broadly reflective of those for freshwater faunas, given differences in key threats and habitats, meeting the needs of tetrapods cannot be assumed sufficient to conserve freshwater species at local scales. A global multi-taxon extinction risk assessment of freshwater fauna for The IUCN Red List of Threatened Species finds one-quarter of species to be at high risk of extinction.",nature_2025_custom
